{"artifact_version":"2.0.0","change_reason":"初始化V2 R1 pilot。","change_summary":"建立待验证的研究设计。","content_hash":"c4d7bdad5a7859669762a5ae8cb054a6b1475f4bb95d65a8fadad314d5b1feb8","created_at":"2026-07-17T00:00:00Z","created_by":"Codex","creation_stage":"research_design","incorporated_event_ids":[],"parent_version_id":null,"project_id":"research_project:humanoid_robot_scale_up_bottlenecks","semantic_version":"0.1.0","snapshot":{"causal_edges":[{"boundary_condition":"目标订单与产品定义已冻结。","causal_edge_id":"causal_edge:humanoid_robot_scale_up_bottlenecks:production_ramp_target_to_duty_cycle_tolerance_requirements","confidence":0.35,"effect_polarity":"positive","feedback_loop_id":null,"from_causal_node_id":"causal_node:humanoid_robot_scale_up_bottlenecks:production_ramp_target","lifecycle_status":"active","mechanism_text":"量产目标把样机性能要求转化为连续duty cycle、公差和寿命门槛。","provenance":{"actor_type":"codex","agent_run_id":"research-project-v2-r1-pilots","created_at":"2026-07-17T00:00:00Z","created_by":"Codex","created_in_version":"research_version:humanoid_robot_scale_up_bottlenecks:0.1.0","review_status":"pending_review"},"relation_type":"may_cause","strength":0.4,"supporting_claim_ids":["claim:humanoid_robot_scale_up_bottlenecks:primary"],"time_lag":"one_product_definition_cycle","to_causal_node_id":"causal_node:humanoid_robot_scale_up_bottlenecks:duty_cycle_tolerance_requirements","validation_metric_ids":["metric:humanoid_robot_scale_up_bottlenecks:primary"]},{"boundary_condition":"模块设计与测试规范保持可比。","causal_edge_id":"causal_edge:humanoid_robot_scale_up_bottlenecks:duty_cycle_tolerance_requirements_to_module_assembly_calibration_test","confidence":0.35,"effect_polarity":"positive","feedback_loop_id":null,"from_causal_node_id":"causal_node:humanoid_robot_scale_up_bottlenecks:duty_cycle_tolerance_requirements","lifecycle_status":"active","mechanism_text":"可靠性与公差要求决定装配、标定、测试覆盖率和工时。","provenance":{"actor_type":"codex","agent_run_id":"research-project-v2-r1-pilots","created_at":"2026-07-17T00:00:00Z","created_by":"Codex","created_in_version":"research_version:humanoid_robot_scale_up_bottlenecks:0.1.0","review_status":"pending_review"},"relation_type":"may_cause","strength":0.4,"supporting_claim_ids":["claim:humanoid_robot_scale_up_bottlenecks:primary"],"time_lag":"one_engineering_ramp_cycle","to_causal_node_id":"causal_node:humanoid_robot_scale_up_bottlenecks:module_assembly_calibration_test","validation_metric_ids":["metric:humanoid_robot_scale_up_bottlenecks:primary"]},{"boundary_condition":"按合格模块出货量加权。","causal_edge_id":"causal_edge:humanoid_robot_scale_up_bottlenecks:module_assembly_calibration_test_to_yield_reliability_supplier_constraint","confidence":0.35,"effect_polarity":"negative","feedback_loop_id":null,"from_causal_node_id":"causal_node:humanoid_robot_scale_up_bottlenecks:module_assembly_calibration_test","lifecycle_status":"active","mechanism_text":"装配标定复杂度影响首轮良率、返工、MTBF和供应商放量能力。","provenance":{"actor_type":"codex","agent_run_id":"research-project-v2-r1-pilots","created_at":"2026-07-17T00:00:00Z","created_by":"Codex","created_in_version":"research_version:humanoid_robot_scale_up_bottlenecks:0.1.0","review_status":"pending_review"},"relation_type":"may_cause","strength":0.4,"supporting_claim_ids":["claim:humanoid_robot_scale_up_bottlenecks:primary"],"time_lag":"three_consecutive_months","to_causal_node_id":"causal_node:humanoid_robot_scale_up_bottlenecks:yield_reliability_supplier_constraint","validation_metric_ids":["metric:humanoid_robot_scale_up_bottlenecks:primary"]},{"boundary_condition":"软件、安全与真实订单不构成更早约束。","causal_edge_id":"causal_edge:humanoid_robot_scale_up_bottlenecks:yield_reliability_supplier_constraint_to_ramp_cost_delivery","confidence":0.35,"effect_polarity":"conditional","feedback_loop_id":null,"from_causal_node_id":"causal_node:humanoid_robot_scale_up_bottlenecks:yield_reliability_supplier_constraint","lifecycle_status":"active","mechanism_text":"良率可靠性约束决定takt、单位成本与交付爬坡能否达成。","provenance":{"actor_type":"codex","agent_run_id":"research-project-v2-r1-pilots","created_at":"2026-07-17T00:00:00Z","created_by":"Codex","created_in_version":"research_version:humanoid_robot_scale_up_bottlenecks:0.1.0","review_status":"pending_review"},"relation_type":"may_cause","strength":0.4,"supporting_claim_ids":["claim:humanoid_robot_scale_up_bottlenecks:primary"],"time_lag":"two_product_cycles","to_causal_node_id":"causal_node:humanoid_robot_scale_up_bottlenecks:ramp_cost_delivery","validation_metric_ids":["metric:humanoid_robot_scale_up_bottlenecks:primary"]}],"causal_nodes":[{"causal_node_id":"causal_node:humanoid_robot_scale_up_bottlenecks:production_ramp_target","lifecycle_status":"active","node_kind":"trigger","node_text":"机器人量产目标、月度交付节拍与单位成本下降要求","provenance":{"actor_type":"codex","agent_run_id":"research-project-v2-r1-pilots","created_at":"2026-07-17T00:00:00Z","created_by":"Codex","created_in_version":"research_version:humanoid_robot_scale_up_bottlenecks:0.1.0","review_status":"pending_review"}},{"causal_node_id":"causal_node:humanoid_robot_scale_up_bottlenecks:duty_cycle_tolerance_requirements","lifecycle_status":"active","node_kind":"system_parameter","node_text":"关节、灵巧手、传感器、线束和热管理的duty cycle可靠性与公差要求","provenance":{"actor_type":"codex","agent_run_id":"research-project-v2-r1-pilots","created_at":"2026-07-17T00:00:00Z","created_by":"Codex","created_in_version":"research_version:humanoid_robot_scale_up_bottlenecks:0.1.0","review_status":"pending_review"}},{"causal_node_id":"causal_node:humanoid_robot_scale_up_bottlenecks:module_assembly_calibration_test","lifecycle_status":"active","node_kind":"mechanism","node_text":"模块装配、标定、功能测试与整机联调流程","provenance":{"actor_type":"codex","agent_run_id":"research-project-v2-r1-pilots","created_at":"2026-07-17T00:00:00Z","created_by":"Codex","created_in_version":"research_version:humanoid_robot_scale_up_bottlenecks:0.1.0","review_status":"pending_review"}},{"causal_node_id":"causal_node:humanoid_robot_scale_up_bottlenecks:yield_reliability_supplier_constraint","lifecycle_status":"active","node_kind":"constraint","node_text":"首轮良率、返工、MTBF与供应商批次一致性约束","provenance":{"actor_type":"codex","agent_run_id":"research-project-v2-r1-pilots","created_at":"2026-07-17T00:00:00Z","created_by":"Codex","created_in_version":"research_version:humanoid_robot_scale_up_bottlenecks:0.1.0","review_status":"pending_review"}},{"causal_node_id":"causal_node:humanoid_robot_scale_up_bottlenecks:ramp_cost_delivery","lifecycle_status":"active","node_kind":"outcome","node_text":"量产ramp的单位成本、takt达成和合格交付结果","provenance":{"actor_type":"codex","agent_run_id":"research-project-v2-r1-pilots","created_at":"2026-07-17T00:00:00Z","created_by":"Codex","created_in_version":"research_version:humanoid_robot_scale_up_bottlenecks:0.1.0","review_status":"pending_review"}}],"claim_relations":[{"created_in_version":"research_version:humanoid_robot_scale_up_bottlenecks:0.1.0","from_claim_id":"claim:humanoid_robot_scale_up_bottlenecks:counter","provenance":{"actor_type":"codex","agent_run_id":"research-project-v2-r1-pilots","created_at":"2026-07-17T00:00:00Z","created_by":"Codex","created_in_version":"research_version:humanoid_robot_scale_up_bottlenecks:0.1.0","review_status":"pending_review"},"relation_id":"claim_relation:humanoid_robot_scale_up_bottlenecks:counter","relation_summary":"替代解释挑战主假设。","relation_type":"challenges","to_claim_id":"claim:humanoid_robot_scale_up_bottlenecks:primary"}],"claims":[{"claim_id":"claim:humanoid_robot_scale_up_bottlenecks:primary","claim_kind":"primary","claim_status":"hypothesis","claim_text":"量产瓶颈可能从样机部件可得性迁移到执行器、灵巧手、传感器的可靠性、良率、装配测试和认证，尚待验证。","confidence":0.38,"context_reference_ids":["reference:humanoid_robot_scale_up_bottlenecks:background","reference:humanoid_robot_scale_up_bottlenecks:scope_context"],"created_in_version":"research_version:humanoid_robot_scale_up_bottlenecks:0.1.0","epistemic_type":"hypothesis","importance":0.95,"invalidation_condition_ids":["condition:humanoid_robot_scale_up_bottlenecks:primary"],"lifecycle_status":"active","linked_question_ids":["question:humanoid_robot_scale_up_bottlenecks:primary","question:humanoid_robot_scale_up_bottlenecks:mechanism","question:humanoid_robot_scale_up_bottlenecks:constraint","question:humanoid_robot_scale_up_bottlenecks:economics","question:humanoid_robot_scale_up_bottlenecks:company_capture","question:humanoid_robot_scale_up_bottlenecks:validation"],"provenance":{"actor_type":"codex","agent_run_id":"research-project-v2-r1-pilots","created_at":"2026-07-17T00:00:00Z","created_by":"Codex","created_in_version":"research_version:humanoid_robot_scale_up_bottlenecks:0.1.0","review_status":"pending_review"},"supersedes_claim_id":null,"validation_metric_ids":["metric:humanoid_robot_scale_up_bottlenecks:primary"]},{"claim_id":"claim:humanoid_robot_scale_up_bottlenecks:counter","claim_kind":"counter","claim_status":"under_test","claim_text":"需求节奏、软件数据与安全可能比硬件先形成约束。","confidence":0.32,"context_reference_ids":["reference:humanoid_robot_scale_up_bottlenecks:background"],"created_in_version":"research_version:humanoid_robot_scale_up_bottlenecks:0.1.0","epistemic_type":"hypothesis","importance":0.84,"invalidation_condition_ids":[],"lifecycle_status":"active","linked_question_ids":["question:humanoid_robot_scale_up_bottlenecks:counterfactual"],"provenance":{"actor_type":"codex","agent_run_id":"research-project-v2-r1-pilots","created_at":"2026-07-17T00:00:00Z","created_by":"Codex","created_in_version":"research_version:humanoid_robot_scale_up_bottlenecks:0.1.0","review_status":"pending_review"},"supersedes_claim_id":null,"validation_metric_ids":[]}],"company_capture_assessments":[],"conclusion_status":"unavailable","evidence_assessments":[],"evidence_requirements":[{"collection_status":"not_started","conflict_search_required":true,"minimum_coverage":2,"primary_source_required":true,"provenance":{"actor_type":"codex","agent_run_id":"research-project-v2-r1-pilots","created_at":"2026-07-17T00:00:00Z","created_by":"Codex","created_in_version":"research_version:humanoid